{"analysisPlan":[{"method":"jinn.benchmarking.method/wilson","parameters":{"verdictRule":"unanimous"},"version":"1"}],"arms":[{"armId":"armA","pinning":{"harness":{"id":"kit","version":"1"},"model":{"id":"model-a"}}},{"armId":"armB","pinning":{"harness":{"id":"kit","version":"1"},"model":{"id":"model-b"}}}],"benchmark":{"digest":{"sha256":"70dd853e24d61b6d216923bb77b892eca827dab9eec5a2dfc40edff0307d461f"}},"closeAt":"2026-08-04T00:00:00Z","owner":"urn:uuid:20000000-0000-5000-8000-000000000002","policy":{"cellWindow":3600000,"completenessFloor":"0.5","evaluation":{"distinctEvaluator":true,"minVerdicts":1},"independence":"gating","replacement":{"allowed":true,"maxPerCell":1},"submissionBaseline":{"isolationPolicy":"fixture"}},"protocol":"https://jinn.network/protocols/benchmarking/1.0","replicates":2,"venue":{"kind":"self-run","note":"fixture-only append-order venue"}}