{
  "protocol": "https://jinn.network/protocols/benchmarking/1.0",
  "benchmark": {
    "digest": { "sha256": "5c26b8b5ab2cfe8feb60e9136c17eb0dde331c93e8fec7b305e205255eea5e87" }
  },
  "owner": "urn:uuid:22222222-2222-5222-8222-222222222222",
  "arms": [
    {
      "armId": "armA",
      "pinning": { "harness": { "id": "claude-code", "version": "1.0.0" }, "model": { "id": "claude-haiku-4-5" } }
    },
    {
      "armId": "armB",
      "pinning": { "harness": { "id": "claude-code", "version": "1.0.0" }, "model": { "id": "claude-sonnet-4-5" } }
    }
  ],
  "replicates": 2,
  "policy": {
    "completenessFloor": "0.8",
    "cellWindow": 3600000,
    "replacement": { "allowed": true, "maxPerCell": 2 },
    "independence": "gating",
    "evaluation": { "minVerdicts": 1, "distinctEvaluator": true },
    "submissionBaseline": { "isolationPolicy": "sandboxed" }
  },
  "analysisPlan": [
    { "method": "jinn.benchmarking.method/paired-mcnemar", "version": "1", "parameters": {} }
  ],
  "budget": {
    "perCell": { "solve": "0.10", "evaluate": "0.02" },
    "hardCap": "50.00",
    "unit": "OLAS"
  },
  "venue": { "kind": "self-run" },
  "closeAt": "2026-08-04T00:00:00Z"
}
